,sort_name,df_min,df_max,appearances,review,name,address,pro_score,sentiment
72,gloria pizza,123,123,1,"This downtown Forest Hills fixture goes all the way back to 1960, but underwent a hiatus early in this century. Now it’s back and better than ever, offering a well-windowed dining room and the usual rich profusion of slice choices. Our fave is the grandma slice: a crisp, square crust with an impressive slab of mozzarella, a slice of fresh tomato, and strips of roasted red pepper, making for an unusual slice that tastes like an Italian street fair.",Gloria Pizza,"108-22 Queens Blvd, Forest Hills, NY 11375",0.45602605863192175,0.8978713664425363
73,golden pizza,124,124,1,"Golden is about as bare-bones as a pizzeria can be, yet it has obviously been feeding the populace of its Mott Haven neighborhood for a good long time. The dining room is standing-only, and the counter routinely displays only one kind of slice, yet what a slice it is. Trim, nicely clotted with good cheese, not quite thin-crusted but crisp and tasty nonetheless. You can have some pepperoni thrown on top, but it’s not necessary. And, miracle of miracles, an entire cheese pie can be had for $6.50, which is less than dollar slice places charge.",Golden Pizza,"504 E 138th St, Bronx, NY 10454",0.45602605863192175,0.9326867720888113
74,gran torino,125,125,1,"Gran Torino is a giant indoor/outdoor bar in Williamsburg with an Italian counter where you can order pizzas and snacks. Gran Torino is an Italian restaurant near the Bedford stop in Williamsburg and it has a very large backyard with its very own outdoor bar. Considering this place is pretty much made for Williamsburg day drinking, the food is better than it needs to be. Head to the counter inside, where you can order personal Neapolitan pizzas, salads, and other Italian snacks. We like the kale caesar that’s not embarrassed about how many anchovies are in its dressing, and the personal-sized pizza with olives, mushrooms, and a nice blanket of prosciutto on top.Pizza, Italian, Big Groups, Day Drinking, Outdoor/Patio Situation, ",Gran Torino,,0.016286644951140017,0.41405505376683155
75,grimaldis,126,128,3," Juliana's may have Patsy Grimaldi and his decades-old technique, but Grimaldi's has the name -- and so it attracts scores of tourists who line up in the shadow of the Brooklyn Bridge. Juliana's has deservedly eclipsed Grimaldi's in critical acclaim, but that doesn't mean a pie from Grimaldi's isn't good enough to tempt you to play tourist for a day. The oven is coal-fired, the crust is thin, and the famous name is everywhere, thanks to a franchise across the country. ""Obviously to me, personally, Brooklyn has the best pizza. I don't know if it's our guys are all original that are here. It's like Grandma -- Grandma is always gonna make the best meatballs. She can teach you, but..."" manager Gina Peluso trailed off as she described the difference between the Brooklyn location and the others. ""Obviously sleight of hand changes pizza, and water changes pizza, and climate changes pizza. But we try our best."" An extremely popular Brooklyn pizzeria.People line up down the block for Grimaldi’s. This pizzeria has been around for several decades, and it’s famous for the blistered and chewy pies coming out of its coal-fired oven. So go ahead and brave the crowds for this better-than-average Neapolitan pizza - just know that this place is officially a tourist trap and might as well be in Little Italy. Check it if you want to weigh in on the best-pizza-in-NYC debate, however.Pizza, Classic Establishment, Unique Dining Experience, Grimaldi's is a good spot for pizza in Coney Island. (FYI, it's cash-only, and you can't get slices here.)From the outside, the Coney Island Grimaldi’s seems like a tourist trap. Maybe it’s the big rotating sign that looks like it was borrowed from a car wash - or maybe it’s the picture of the New York City skyline above the entrance. Either way, it’s actually a good place to sit down and eat a crispy-crusted pizza. They don’t do slices, so be sure to come with at least one other person. Also, it’s cash-only.Pizza, Big Groups, Kids, Lunch, ",Grimaldi’s Coal Brick-Oven Pizza,1 Front St.,0.032573289902280034,0.977274995078835
76,gruppo,129,129,1,"Gruppo is a casual thin-crust pizza spot across from Tompkins Square Park in the East Village. Gruppo is a thin-crust pizza spot on Avenue B with an atmosphere somewhere between Two Boots and Nicoletta, meaning there’s bar seating and some affordable wine options, but you could also walk in with a group after a pick-up basketball game across the street in Tompkins Square Park. You can choose your own toppings or go with any of the 15 house varieties, which come in personal and shareable sizes. A personal pie is pretty small, so get a small plate like the prosciutto crostini as well.American, Pizza, Italian, Big Groups, Casual Weeknight Dinner, Drinks & A Light Bite, ",Gruppo,,0.016286644951140017,0.6853979935435265
77,highline pizzeria,130,130,1,"Proving again that even today neighborhood pizzerias are opening up, Highline appeared not too long ago on the edge of Hudson Yards, peddling a menu of predictable slices with a few new twists. The pale crust is distinguished, and one of the best uses is in a pie topped with cubed chicken cutlet and fresh ripe tomato. This place floods with construction workers from nearby high-rises in the post-noon period.",Highline Pizzeria,"503 W 28th St, New York, NY 10001",0.45602605863192175,0.46861093884074584
78,houdini kitchen laboratory,131,132,2,"Located in an industrial stretch of Ridgewood, this inventive pizzeria pulls off a number of tricks with carefully curated ingredients. Taking residence in a repurposed brewery built in the late 1800s, the red brick structure sits near the borough’s massive cemeteries where this establishment’s namesake has been laid to rest. While the 'lab' isn't large, it feels cavernous nonetheless, thanks to high ceilings, sparse digs that include a sprinkling of tables with views of the cement dome oven and an ample covered terrace. Tuck in to salads, homemade pastas and burrata, as well as wood-fired pies that include the Guido BK which celebrates the bitter beauty of broccoli rabe and shares its charred crust with red wine-cured sausage and mozzarella.Ridgewood’s hottest pizza hangout. Is it the next Roberta’s?It’s a shame that more restaurants don’t have excellent names. People love to say, “Hey, that’d be a great name for a band!” but rarely, “Hey, that’d be a great name for a restaurant.” As a result, most new restaurants end up being called something like “The [Insert A Random Non-English Noun]” or “[Insert A Random Workshop Tool] & [Insert A Random Obscure Animal].”Pizza, Italian, Queens, Big Groups, Delivery, Outdoor/Patio Situation, ",Houdini Kitchen Laboratory,,0.6156351791530942,0.9557925722764123
79,house of pizza and calzone,133,133,1,"The Vibe: This neighborhood pizzeria ""has been servicing the working waterfront and it’s residents for over 60 years. Still located on the same block it originated back in the early 50’s,""  Stop in for authentic Brooklyn pizza.  ",House of Pizza and Calzone,"132 Union St, Brooklyn, NY 11231-2983, USA",0.5211726384364819,0.0
80,industry kitchen,134,134,1,"Industry Kitchen is a good spot to day drink outside with a group near the South Street Seaport.You may know Industry Kitchen as the place with a $2000 pizza on the menu, but unless you desperately want to eat golden leaves, you should know this spot for its outdoor seating situation. It’s on the East River near the South Street Seaport, and has a lot of tables next to the running path with great views of the river and Brooklyn. If you do want some food, the thin-crust pizzas are actually pretty good, like the $16 margherita pie that’s more than enough for one person.American, Bar Food, Pizza, Financial District, Big Groups, Day Drinking, Drinks & A Light Bite, Lunch, Outdoor/Patio Situation, ",Industry Kitchen,,0.016286644951140017,0.8677919051766445
81,italy pizza,135,135,1,"Are you a fan of the white slice? This narrow pizzeria — with a stamped-tin ceiling and other features that telegraph its age — specializes in these slices, with a white pie always displayed on the counter. The cheese is profusely laid on, with so much garlic, you’ll be burping it for hours if not days afterwards. Lasagna, garlic knots, and salads are also recommended at this establishment in the Greenpoint business district, close to bars and clubs.",Italy Pizza,"800 Manhattan Ave, Brooklyn, NY 11222",0.45602605863192175,0.41405505376683155
82,ivanas pizzeria,136,136,1,"This ancient pizzeria retains its nostalgic, time-worn décor, including dozens of framed photographs from the last six decades. The location is iconic: in the midst of the Bronx’s Little Italy (a/k/a Belmont or Arthur Avenue), the pizza here is much better than at surrounding, snazzier pizzerias. Start with the modest cheese slice, which glistens with exuded oils, necessitating the classic New York fold. The slice is salty, the crust nicely browned, the ""bone"" (circumferential crust) almost non-existent. This constitutes one of the Bronx’s best slices, idiosyncratic and made with evident pride.",Ivana's Pizzeria,"2373 Arthur Ave, Bronx, NY 10458",0.45602605863192175,0.6776750037148436
83,j&v pizza,137,137,1,"The regular slice at this authentically retro Bensonhurst mainstay is very good, with salty cheese. There's a unique, crunchy grandma slice. But the Sicilian? Fantastic, light, and airy, with goopy cheese cascading down the sides. It's the thing to get.",J&V Pizza,6322 18th Avenue,0.260586319218241,0.6167639278448227
84,joe & pats,138,145,8,"This Staten Island mainstay is well worth a hop across the harbor for its incredible vodka pie, so-named for the vodka-infused sauce it incorporates, along with mozzarella and basil. Though the classic, thin-crust classic cheese pie—on offer by the pie or the slice—is always an excellent bet. The family-run pizzeria has a devout local following; with pies this good, it’s little wonder that it’s been in business since 1960.A photo of a slice from Staten Island legend Joe & Pat's is instantly recognizable: a super-thin, flat crust all the way to the edge, with discrete cubes of low-moisture mozzarella that melt into distinct blobs (rather than the full coverage that comes from using shredded cheese), against a background of very simple tomato sauce. Joe & Pat’s is a classic Staten Island pizza place.The vodka pie at Joe & Pats is one of the best pizzas you can eat in this city. Due to the thinness of the crust here, you probably don’t want to get more than one additional topping on any one pie, but that isn’t necessarily a bad thing. It means you can eat more pizza, which you will inevitably want to do here. If you don’t live in Staten Island, this place alone is worth the trip.Pizza, Italian, Big Groups, Casual Weeknight Dinner, Classic Establishment, Kids, Joe & Pat’s is the East Village location of a famous Staten Island pizza place. When we heard that Joe & Pat’s - one of our top 20 pizza places - had opened their first-ever Manhattan spot, we had two immediate thoughts, in this order: 1) We want vodka pizza and 2) Will it live up to the original? Good news: the pies here are as delicious and crackery-thin as they are at the original, and now, if you’re not a Staten Island resident, you won’t have to take a ferry to try some of the best pizza in the city. We especially like the vodka pie with cheese that mixes into the sauce like a tie-dye shirt, but you could conceivably eat non-pizza dishes here too, like chicken parm and baked clams. The space itself also feels a lot like the original, with walls covered in family photos and Italian Renaissance murals. Our only issue is that the prices are noticeably higher here than on Staten Island - although Manhattan tends to have that effect on things.Pizza, Italian, Casual Weeknight Dinner, Classic Establishment,  If you are a connoisseur of thin-crust pizza, get yourself to Joe & Pat's, which has been dishing it out since 1960, setting the bar for the crispy pies that typify the borough's pizza scene. ""It's thin crust, fresh sauce, and we use the cubed mozzarella so it has the spotty cheese on it,"" owner Casey Pappalardo said. ""It's a nice look."" Joe & Pat's, too, has come to Manhattan -- opening an outpost in lower Manhattan in April 2017 -- but, like Denino's, the original is worth visiting. The celebrated Staten Island pizza stalwart, open since 1960, has made its extra-crunchy, mozzarella-laden thin-crust pies available in the East Village. Co-owned by Casey Pappalardo, his father, and two uncles, the family-run place opened its first Manhattan location in spiffier digs than the original Joe & Pat’s. Here, there are wood tables, a full bar, and real plates instead of paper ones. In addition to pizza, expect well-executed takes on classic dishes like chicken parm and shrimp scampi.If you never leave Manhattan, you might think that Rubirosa is the only place that makes a super-thin-crust pie with excellent vodka sauce. This is not, however, the case. The vodka pie at Joe & Pat’s is only slightly inferior to the one at Rubirosa - and by that we mean that it’s one of the best pizzas you can eat in this city. Due to the thinness of the crust here, you probably don’t want to get more than one additional topping on any one pie, but that isn’t necessarily a bad thing. It means you can eat more pizza, which you will inevitably want to do here. If you don’t live in Staten Island, this place alone is worth the trip.Topped with creamy mozzarella melted in cubes upon a rich bed of savory tomato sauce spread to the edge of a thin crisp crust, a Joe & Pat’s pizza takes simple ingredients and prepares them exquisitely. It’s a recipe that has been perfected over the past 50 years and we hope it never changes. And now, you can get a taste at the East Vilalge outpost.Plain cheese",Joe & Pat’s Pizzeria,"4503, 168 1st Avenue, New York, NY 10009",2.856677524429967,0.9955744117456238
85,joes pizza,146,154,9,"Times Square becomes slightly more tolerable when you know there’s a Joe’s Pizza there. Joe’s is thin-crust royalty, and their Times Square location is right next to the 42nd Street N,R,Q,W station exit. So the next time you're in the area and need something fast - this is where you should be stopping.Pizza, Midtown, Pre-Theater Eats, Quick Eats, The Vitruvian Man and affordable West Village apartments and a classic New York slice. These are theoretical ideals of the perfect form, rather than actual realities. There are slice shops on every street in the city striving for that mix of foldable crust, stretching mozzarella, sweet tomato sauce, and droplets of grease - but none of them achieve the optimal balance like Joe’s. The Carmine Street pizza spot makes the best New York slice in New York. They fold like they’ve been constructed to have a perforated edge through the middle, and the evenly-coated mozzarella and sweet tomato sauce are in ideal proportion to the crust.Joe’s is home to the best slice of pizza in NYC. Full stop.Move over people, the champ is here. Joe’s is the best slice in Manhattan. It’s been like that forever and will remain that way for eternity. If you can make a case for any other slice on the island of Manhattan, please let us know. Then again, you can’t, so don’t bother.Pizza, Cheap Eats, Classic Establishment, Impressing Out of Towners, Quick Eats, When neoclassical slice-shop owners say they emulate the old-school joints that still obsess over quality, Joe’s is one of the places they’re talking about. The slices taste and look the way they did 30 years ago; there’s still a red border of pure tomato next to the outer crust, and the pies aren’t pulled from the oven until the cheese has a suntan.King of the neighborhood pizza parlors, Manhattan edition, Joe’s offers a slice magnificent in its plainness, appreciated by generations of New Yorkers and visitors. No frou-frou here, just a well-pureed sauce and just enough cheese — but not too much — and one of the city’s most perfect crusts. On the other hand, for just a bit more you can get the fresh mozzarella slice, with little annealed gobs of newly minted cheese. But the best-selling slice, according to a counter guy I talked to, is the pepperoni slice. Miraculously, new branches of this place near Union Square, Times Square, and in Williamsburg have not diminished its brilliance.Listen. Joe's is a good slice. A great one, depending on your level of inebriation, even. It's sweet and it's larger than your head and regardless of how that all makes you feel, you've gotta try it at least once.For a quick slice late-night—or any other time—you can’t beat this classic chain of Manhattan/Brooklyn pizzerias (the original West Village location opened in 1975). The thin-crust plain and pepperoni slices here are the real-deal, affordable, New York City-style pizza of your imagination—fast, easy, no-frills, but downright delicious. Happily, you’ll find consistent pizza goodness at any of Joe’s Pizza’s four outposts.Great pizza doesn’t have to cost an arm and a leg. Just look at Joe’s Pizza as the prime example. The pizza shop, which has been operating since 1975, has been serving up delicious slices for decades and at just $2.75 per slice. Tha means visitors can buy a slice for the same price as a subway ridePriceThis is the New York–iest of New York slices. It defines classic NY slice pizza—crisp, thin crust, crushed canned tomatoes as sauce, low-moisture mozzarella for cheese. Don't bother with the fresh-mozz slices—they're invariably bland. Joe's is so consistent in all its locations (a bunch of NYC shops and one in Shanghai) that I have dreams of it replacing every mediocre Famiglia in airports and malls and train stations everywhere.",Joe's Pizza,7 Carmine St.,3.1986970684039084,0.9970481539282194
86,johns of bleecker street,155,156,2,"This well-worn, wooden booth-lined place is one of the city’s oldest and justifiably famous pizzerias, opened in 1929 by John Sasso, an alum of Lombardi’s (like the founders of Patsy’s and Totonno’s). John’s serves its expertly charred coal-oven variety, which remains a faithful version of classic NY-style pizza, strictly by the pie. Try a plain pie, generously topped with sauce and cheese, or minimally accessorize with one of the traditional toppings available, like mushrooms. Prepare to wait in line.John's has been here for about as long as this city, and it'll be here long after we're all gone. The pizza is so, so good in all the ways you hope pizza will be: cheesy, sturdy, saucy, crunchy. Sit with a pie and clear plastic pitchers of Coke and beer, and feel the New York-ness of it all around you.",John's of Bleecker Street,"278 Bleecker Street, New York, NY, 10014",0.521172638436482,0.9268813194252618
87,julianas,157,161,5," Gather 'round for the saga of how acclaimed pizzaiolo Patsy Grimaldi came to Juliana's after running Grimaldi's, formerly known as Patsy's. Grimaldi learned the business at his uncle's restaurant Patsy's in East Harlem, one the city's great early pizzerias, and opened his own Patsy's under the Brooklyn Bridge in 1990. But in 1995 he was sued by the man who'd bought the East Harlem Patsy's, and the end result was a name change to Grimaldi's. In 1998, Grimaldi decided to get out of the pizza game, so he and his wife sold Grimaldi's to a customer. Over time, Grimaldi became frustrated with the way his namesake was being run, leading to bad blood as Grimaldi's expanded but its critical reputation suffered. When Grimaldi's moved a few doors down, Patsy Grimaldi wound up reclaiming his old space with another former customer of his, co-owner Matt Grogan. Unable to use either of his own names, Grimaldi christened the new restaurant with his mother's name: Juliana. ""I thought when I had the pizza for the first time in 1990, that not only was it the best pizza I had ever had in my life, but it was the best thing I ever had in my life,"" Grogan said. Grimaldi, 85, still comes in every night, and the pizza is made to his exacting standards, in a coal-fired oven and topped with ingredients like tomatoes that come from an Italian co-op that you can get only at Juliana's and one other restaurant, on the West Coast. The edges are blistered, the coal imparts a signature flavor and the decades of experience shine through in every perfect bite. ""We're not trying to make Italian pizza,"" Grogan said. ""We're making New York pizza, the way it was first made 100 years ago."" Patsy Grimaldi—the flour-dusted legend behind Grimaldi's, which has since changed hands—busts out of retirement to reclaim his pie shop's first location, along with its original coal oven. The octogenarian pizzaiolo–who learned to spin dough at age 13 in his Uncle Patsy Lancieri's Harlem institution—named the spot after his mother. The menu spotlights iconic red-sauce fare, including classic pies (Margherita, sausage and broccoli rabe), appetizers (eggplant rollatine, baked clams with parsley) and desserts (cannoli), but the New York icon mixed in a few nods to modern times, like a bagel-riffing pie made with lox and mascarpone. Juliana'sArmed with a tried-and-true coal oven, owner Patsy Grimaldi came out of retirement to to open his new Brooklyn Heights pizzeria called Juliana’s. He couldn't name it after himself because both his first and last name's were already taken by two of his biggest competitors: Patsy’s and Grimaldi's. This blistered beauty is a white pie topped with mozzarella, smokey scamorza affumicata, pancetta, scallions and oregon-grown white truffles in olive oil.No. 1 SpecialOne of the main pizza destinations in Brooklyn Heights.This is the main Grimaldi’s alternative. It’s only a few doors down from that more-famous pizzeria, and it gets pretty busy as well. That’s because Patsy Grimaldi opened it (after he sold Grimaldi’s). The pizza here is also in the chewy, charred Neapolitan style, and they use a coal-burning oven the same as their neighbor.Pizza, Brooklyn, Classic Establishment, Unique Dining Experience, None",Juliana's Pizza,"19 Old Fulton St, Brooklyn, NY",1.1400651465798042,0.9362169983726294
88,kesté,162,167,6,"Since owner Robert Caporuscio started slinging Neapolitan pies in 2009, Kesté has been among the city’s top places for the Southern Italian style of pizza. It’s comprised of extra-fine “00” Caputo flour, San Marzano tomatoes, and buffalo mozzarella, with a crisp-pillowy hybrid crust and premium, sparingly applied toppings. A dizzying range of dozens of pies are on offer, some starring harder-to-find toppings like walnut cream or bresaola. Caporuscio has expanded Keste to Fidi, with a 5,000-square-foot outpost that includes a pizza school helmed by Caporuscio’s daughter, Giorgia.As anticipated, Kesté serves up some of the best pizza in town.If there's one cuisine whose hype is usually warranted, it's pizza. Because of its universal nature, critics and ""the people"" will generally see eye to eye. At the end of the day most pizza is either fantastic or good enough and it doesn't take a food expert to distinguish between the two. With these facts in mind, The Infatuation was fired up to investigate New York Mag's declaration of Kesté as NYC's best pie of the moment.Pizza, Dining Solo, With the original located in the West Village (there are newer outposts Downtown and in Williamsburg, Brooklyn), Kesté offers pizza lovers both classic and creative Neapolitan pizzas that are prepared in a wood-fired oven. Chef Roberto Caporuscio grew up outside of Naples and learned his craft there before opening Kesté in New York City. Although homemade mozzarella cheese graces most of the pies, folks with dietary restrictions will love the gluten-free, vegetarian, and vegan offerings on the menu.It wasn’t that long ago that we picked Kesté’s pizza as New York’s numero uno. But don’t regard the pizzeria’s third-place ranking on this listicle as a sign that quality on Bleecker Street has slipped, or that Roberto Caporuscio has lost his touch. No, the pizza at Kesté is as good as ever — soft and tender, charred and chewy, and about as well balanced as Sting and Trudie Styler in the yab-yum pose. No, what’s happened is that the craze for Neapolitan pizza Kesté helped ignite has created a lot of competition, which is not a bad thing for Neapolitan pizza fans.How blessed are we to live in a day and age that such a thing as burrata pizza exists? And, furthermore, that there are people who've mastered the hell out of it?Mamma mia! New York’s love affair with Kesté shows no sign of stopping. This kitchen begins with a puffy, blistered crust that’s perfectly salty and tangy, then tops it with ingredients like roasted butternut squash purée, smoked mozzarella and basil. And while its ingredients seem to have taken a small hit in recent years, that crust is still on point. Co-owner Roberto Caporuscio presides over the American chapter of Associazione Pizzaiuoli Napoletani, and his daughter, Giorgia, oversees the in-house pizza making operations. Diners can choose from more than 22 pizzas (including a few gluten-free options), a roster of calzoni and nightly pie specials. The restaurant is teeny-tiny, but diners are encouraged to linger, in true Italian hospitality.",Kesté Pizza & Vino,"271 Bleecker Street, New York, NY, 10014",1.8534201954397387,0.9887772425472084
