,sort_name,df_min,df_max,appearances,review,name,address,pro_score,sentiment
167,politos pizza,331,331,1,"Though it was established in 1981 and not long ago appeared timeworn, a more recent renovation has left this Astorian stalwart handsome and comfortable, a place to linger. The grandma slice is the one to get. Perfect for its type, it sports a lush and deep red tomato sauce, flecked with little bits of garlic and onion that add sweetness, and the cheese is exemplary, too.",Polito's Pizza,"38-12 Broadway, Astoria, NY 11103",0.45602605863192175,0.8629286148124548
168,posto,332,333,2,"Posto is a casual spot in Gramercy where you can sit down and eat a good thin-crust pizza.Posto is a casual spot in Gramercy where you can sit down and eat a good thin-crust pizza. They also serve some smaller things like garlic bread and bruschetta, plus a couple of different salads and pastas, and basic (but good) desserts like a warm chocolate chip cookie topped with ice cream. The space has a bunch of little tables and booths, as well as a bar where you can dine solo, and there’s sidewalk seating in the summertime. Stop by for a weeknight meal when you don’t want to spend an amount of money that’ll make you regret leaving the house - and try to make it for Happy Hour, when you get a free cheese pizza with a pitcher of beer or bottle of wine.Pizza, Casual Weeknight Dinner, None",Posto,"310 2nd Ave (at E 18th St.), New York, NY",0.5700325732899021,0.9362169983726294
169,pqr,334,335,2,"PQR is a Roman-style pizza spot on the Upper East Side serving slices topped with everything from pumpkin to porchetta. The pizza at PQR is rectangular, and it’s covered with things like broccoli rabe, burrata, sausage, and pumpkin. It’s all just a little bit fancy and also very good, and the crust is both crispy and fluffy, and you’ll want to eat it plain. PQR is mostly a takeout slice place, however, so you probably shouldn’t plan a date here - although if you want to eat a slice by yourself, you can sit on a stool up front or at one of the tables in the back. Or just pick up and some pizza and eat it at home. And feel free to get the slice with pumpkin on top. It’s roughly six times better it sounds.Pizza, Italian, Casual Weeknight Dinner, Dining Solo, Lunch, Shot through with air bubbles but golden and crisp on both top and bottom, the Roman squares at PQR are the antithesis of thick, pillowy Sicilian slices. Toppings, like potato with rosemary and guaciale or fresh porcini and toasted mozzarella, show a thoroughly Italian sense of what tastes good.",PQR New York (Pizza Quadrata Romana),"1631 Second Avenue (85th Street), Upper East Side",0.3420195439739412,0.8784198768510756
170,pranzo pizza & pasta,336,336,1,"This ancient pizzeria, shuttered for nearly a year by Hurricane Sandy tucks way downtown in a Manhattan maritime location, a stone’s throw from the Staten Island Ferry. Around lunchtime lines are long. Slices are noticeably lush, with an average thickness, an extra-crisp crust and a nicely-browned bone or cornicione. A favorite slice features spinach and a tidal wave of cheese — but no tomato sauce. It's fit for a full meal.",Pranzo Pizza & Pasta,"34 Water St, New York, NY 10004",0.45602605863192175,0.6928901907089776
171,prince street pizza,337,345,9,"NoneWhen Prince Street Pizza opened up in 2012 and replaced a Ray’s outpost that had been around for decades, it looked like a normal neighborhood pizza place where you’d get a regular slice at the end of a late night. And while you can certainly use it as such, it’s the thick, pepperoni-topped Spicy Spring that wins PSP its spot on this list - and it’s also why there’s now a long line here on weekends. It’s a thick-crust Sicilian slice with spicy tomato sauce, stretchy mozzarella, spicy little oil-collecting cups of pepperoni, and possibly some kind of witchcraft. All that said, the plain slice is pretty excellent too.The best slice joint in the Soho/Noho/Nolita region. Get a spicy square slice.A few months ago, we found ourselves walking through Little Italy, when we were stopped by a man and his son. With a sign for WORLD’S BEST CANNOLI framing his head, he asked, “Do you know where we can get some good pizza?” At an outdoor table to his left, an all-blonde family looked at their plates of spaghetti with an air of disappointment. Cue the sad music.Pizza, Cheap Eats, Late Night Eats, Quick Eats, Grab a Neapolitan- or Sicilian-style slice at this pizza joint, located in the space where the original Ray's Pizza once stood. Four signature pies boast neighborhood-inspired names like the thin-crust Mercer Margherita, made with fresh mozzarella, basil and marinara sauce, and the Spicy Spring, topped with Fra Diavolo sauce, spicy sopressata and fresh mozzarella. Our favorite? The green machine with pesto sauce, mozzarella, ricotta, olive oil and black olives.Green MachineThe pizza that started it all — that is, New York City’s current love affair with roni cups. Expect a line out the door and get the Spicy Spring, a Sicilian slice topped with an “absurd” number of curled pepperoni coins.Home of the “Original SoHo Squares,” this tiny grab-and-go spot in Nolita is known for its four varieties of oversized, crispy-bottomed Sicilian and grandma slices. Carnivores can opt in for the unbeatable Spicy Spring, a spicy pepperoni “square” with fresh mozzarella and fra diavolo sauce, while the thin-crust Mercer Margherita, loaded with mozzarella, basil, and marinara never disappoints.Formerly known as ""Ray's,"" Prince Street Pizza easily has one of the greatest square slices in Manhattan, in part for it's greasy, pan-fried crust. It is certainly the best spot to go for a ""grandma square"" the thinner-crust, less saucey version of the classic Sicilian, but the margherita, which is dressed with fresh basil, is equally worthy.Prince Street Pizza took over for Ray’s Pizza in 2012 and has been upping the ante on Sicilian-style pizza ever since. For those not in the know, Sicilian slices in the U.S. are typically thick-crust square pieces, and that’s something Prince Street does perfectly. Opt for the Spicing Spring Pie, which comes with Fra Diavolo sauce, spicy pepperoni, and fresh mozzarellaSicilian-Style PizzaI recently had a really nice bonding moment with someone here on the Delish staff after she'd seen my Insta stories of a Prince Street visit. ""THOSE CRISPY LITTLE PEPPS,"" she exclaimed (via Slack). ""THOSE CRISPY LITTLE PEPPS,"" I replied. We're basically best friends now — it's that good!",Prince Street Pizza,"27 Prince Street, New York, NY, 10012",3.384364820846905,0.9953902961478143
172,prova pizzabar,346,346,1,"For a quick and not-too-expensive sit-down meal inside Grand Central, Prova Pizzabar is worth knowing about. If you need to eat something in the Grand Central dining concourse and have enough time for a quick sit-down meal, Prova Pizzabar is worth knowing about. In addition to the to-go pizza counter, there’s a little table-service area off to the side where you can sit and eat a massive $14 square pie in peace. It’s not the best pizza you’ll ever eat, but it is the best pizza you’ll ever eat while sitting in a semi-private space in Grand Central. Also - expect a bar where people drift in every 10 minutes or so asking for triple whiskeys.Pizza, Casual Weeknight Dinner, Kids, Quick Eats, ",Prova Pizzabar,,0.24429967426710092,0.9424163088731127
173,pugsley pizza,347,348,2," You'll make your maiden voyage to Pugsley for a quick, tasty bite on your way in or out of the New York Botanical Garden, but you'll be drawn back by the charisma of founding pizzaiolo Salvatore Natale. The 73-year-old Sicilian native is virtually a one-man show, bantering with students from nearby Fordham University, pulling out his saxophone for anyone who might listen to him play and just generally clowning around while he works in his open kitchen. The restaurant Natale constructed from the shell of an old horse stable in 1985 matches him whimsy for whimsy. Anything you see painted -- from musical notes above the booths to a cloud inscribed with the words ""Love,"" ""God,"" ""Prosperity,"" ""Melody"" and ""Joy"" -- is the pizza man's own handiwork. All of it shares an overt theme: ""Pizza is good, but love is it -- that's our slogan,"" he says. Natale may call himself primarily an ""artist,"" and he may be modest about his pizza-making skills, but his plain New York-style slice is nothing to sneer at -- especially when you drip a touch of the house-made chili pepper-infused oil on top. It models some fine, browned specimen of cheese bubbles and folds with a satisfying snap. If US News & World Report ranked college pizzerias, Pugsley's would have to be ranked #1: Inexpensive, convenient and open late. Order a full pie, and you're invited behind the counter to bang a suspended gong. According to a sign penned by owner Sal, who is as eccentric as he is Italian (and he's very Italian), you are to associate your goals with the sound of the gong. If your goal in life is to eat Pugsley's pepperoni pizza, it’s a win-win.Pepperoni pizza",Pugsley Pizza,,0.6514657980456025,0.976729505451406
174,razza,349,350,2,"Razza is a wood-fired pizza spot in Jersey City that’s well worth a trip from New York. Or from anywhere else.We’re not going to get pulled into a debate comparing the New Jersey and New York City food scenes. It would start with the usual talking points of water quality in the city and diner culture in Jersey, and devolve into a shouting match over the cost of living and who gets to claim Frank Sinatra.Pizza, Italian, Jersey City, Big Groups, Casual Weeknight Dinner, Date Night, Vegetarians, “F*ck that - it’s not even in New York.” This reaction is to be expected from a lot of New Yorkers who see a Jersey City Pizza spot ranked this high. But even if Razza weren’t in the New York Metropolitan area (it is), and even if it weren’t closer to downtown Manhattan than most spots on this list (it is), the pizza here is so good that it belongs in the Top 20 for New York and New Jersey and Mars. The crust is super thin and light, but it never sags like some Neapolitan pies, and each bite is salty, sweet, and charred. We’d gladly eat it plain, but the locally-sourced toppings, like housemade cheeses and specially-bred hazelnuts, are also phenomenal. Before your next heated discussion about the best pizza in existence, take the Path train two stops to Razza. It’s a lot easier than trying to hitch a ride on one of Elon’s spaceships.",Razza,,1.0358306188925077,0.9362169983726294
175,ribalta,351,352,2,"Ribalta has always felt more Neapolitan than New York, with its European clientele, its raucous soccer broadcasts, and especially its pizza margherita, which tastes as classic as can be: the tender-chewy naturally leavened dough, with its faint and fleeting crackle; the sauce, a burst of pure tomato flavor; and the milky melt of cheese. But, recently, partners (and Neapolitan paesani) Rosario Procino and chef Pasquale Cozzolino upped the ante with yet a second margherita pizza — the STG — dappled with a fior di latte (cow’s-milk mozzarella) instead of the margherita DOC’s buffalo mozzarella. This might seem an insignificant thing, a marketing ruse for gullible American pizza geeks. And yes, those abbreviation-loving Italians always have something to prove (DOC means denominazione di origine controllata; STG stands for specialita traditionale garantita). And yes, even the fior di latte has a backstory: Made from the raw milk of a specific breed of cow that grazes in open fields at high altitudes in the Agerola municipality of Naples, it’s soured naturally over half a day, and the curd is pulled, for mysterious reasons, only very late at night, presumably at the time of the full moon. These measures, absurd as they may sound, make for a slightly tangy, nicely chewy cheese that proves to be the perfect topping for New York’s most perfect margherita pie.     Ribalta is big Italian spot near Union Square that serves solid Neapolitan-style pizzas and works for fun group dinners.Ribalta is a big space in an area that’s definitely not short on restaurants, and yet it rarely ever has room for walk-ins. Probably because it’s a fun group dinner spot that’s convenient for everyone and not too expensive. The Neapolitan pizza is pretty good, there are a bunch of bottles of wine for around $40, and during the day, they project soccer matches on the wall.Pizza, Italian, Greenwich Village, Big Groups, Casual Weeknight Dinner, Gluten-Free Options, Sports!, ",Ribalta,,0.1628664495114005,0.976729505451406
176,rizzos fine pizza,353,354,2,"Known for its crisp Sicilian pie, Rizzo’s has become an institution in Queens since 1959. Since then, the menu has expanded but it’s the Rizzo signature slice: the thin crusted “Sicilian,"" that will keep you coming back. The recipe includes copious amounts of rich, tangy tomato sauce with a single slice of creamy mozzarella, flanked by bits of sharp and mild, grated cheeses. All of these rest atop a thin, crispy gas-powered oven crust. Large squareRizzo's serves a unique slice, which it describes as a ""thin-crust Sicilian."" It's a rectangular slice sparsely topped with sauce and cheese. As with Joe & Pat's, its signature look is the whole discrete-areas-of-sauce-and-cheese thing. But Rizzo's takes it to a whole new level—you can almost imagine them meticulously laying on one two- by three-inch rectangle of sliced cheese per slice. The crust is biscuit-y and dense, but it works. Nobody else is making a slice like this, unless you head to Lazzara's in the Garment District, but that's whole-pie-only.",Rizzo's Fine Pizza,3013 Steinway St,0.6351791530944624,0.6928901907089776
177,robertas,355,365,11,"You probably have a lot of associations with Roberta’s: the first time you went to Bushwick for a restaurant, your favorite lunch if you work in Midtown, the Whole Foods frozen food section, and Frances McDormand. That last one might be specific to us - Frances once sat next to us, but the point is - when people think Roberta’s, they think about a whole lot of other stuff. When it comes down to it though, all of that other stuff is just a distraction from the most important thing: the pizza. It’s chewy and fluffy and what we think longingly about when we eat almost every other Neapolitan pizza. But Roberta’s doesn’t just have the #4 spot because of its crust - the toppings are just as good. In fact, if we had decided its ranking based on the off-menu Bee Sting pie (with pepperoni and hot honey) alone, it might even be #1. If you wanted to show someone the perfect example of a hip Brooklyn restaurant, it would be Roberta's. The unassuming door on a lonely (but way less lonely than when it first opened) corner in Bushwick. The ramshackle tented bar where people gather to wait (and oh, will you wait) for a table. The shipping containers in the urban garden. The most beloved pizza being something you have to order off-menu. You get the picture. Whether you love hipster, do-it-yourself vibes or merely put up with them for good food, you'll find great food inside -- including that off-the-menu pizza, The Beesting. It's topped with mozzarella, sopressata, chili oil and honey, and you should order it and feel cool for knowing about it even though, let's be real, everybody knows about it now. The spicy-sweet-salty combination is oft-imitated but nowhere does it quite as well as Roberta's. If you're a traditionalist, order the Margherita for a beautifully done Neapolitan pie on a crust that is crisp but chewy, made with part Italian ""00"" flour and part all-purpose flour. It'll be worth the wait. NoneThe standout Bushwick restaurant has a takeout operation for picking up a superb pie or two, without waiting at least an hour for a table. But there’s a certain charm to the original, sit-down space for dining in. Try the Speckenwolf pizza and an IPA, with a range of salads, meat plates, pastas, and more offered as well; don’t miss the specials, too.Buzzing with urban-farming fund-raisers, local brewers pouring their ales and food-world luminaries fresh off Heritage Radio interviews, this sprawling hangout has become the unofficial meeting place for Brooklyn's sustainable-food movement. Opened in 2008 by Chris Parachini, Brandon Hoy and Carlo Mirarchi, Roberta's features its own rooftop garden, a food-focused Internet-radio station and a kitchen that turns out pizzas—like the Cheesus Christ, topped with mozzarella, Taleggio, Parmesan, black pepper and cream—that are among the borough's best.Roberta'sRoberta’s is the most important pizza joint in New York City, and this commune of Brooklyn culture only gets better with age. The most important brand in the pizza universe right now isn’t Pizza Hut or Dominos or the company making those inflatable pizza rafts. It is, without a doubt, Roberta’s. What they’ve managed to create is downright astonishing. It’s now an internationally renowned brand that’s spawned copycats and imitators all across the globe.Pizza, Brooklyn, Birthdays, Brunch, Day Drinking, Kids, Lunch, Outdoor/Patio Situation, Walk-Ins, This famed hipster hangout in Bushwick, Brooklyn, offers much more than just killer pizza, with a rooftop garden and bakery on site – not to mention a radio station broadcasting here around the clock. Tasty NYC/Neapolitan-hybrid pies star on the menu, loaded with homegrown produce, charcuterie, fresh sauces, herbs, and cheeses. Choose from some eight varieties, like the Beastmaster, smothered in tomato, mozzarella, gorgonzola, pork sausage, onion, capers, and jalapeno.Only available on the lunch menu now, the ""Bee Sting"" (prepared with tomato, mozzarella, caciocavello, sopressata, chili, honey and basil) remains one of Roberta's most excellent slices. Now you can find spicy honey on a lot of Brooklyn menus, but Roberta's really created the standard by which other dishes using it would have to live up to. Bee StingOne of New York's most influential restaurants is a pizza-centric place that has become so popular that Jay-Z and Beyonce are regular diners. It isn't a part of the neighborhood: it's created one. Fast-forward a few years later, and their massive compound now includes a bakery and a tasting-menu restaurant, Blanca. Roberta's pizza doesn't follow the rules, and they'll throw anything on top of that dough. The wood-fired, crispy bottom pies are some of the best around. Who doesn't love a crispy bottom?At some point in its lifetime, Roberta’s really could have easily become the butt of a joke. A Bushwick restaurant run by stoners, with a radio station and an “urban garden,” that Manhattanites and tourists love to obsess over and which regularly has two hour waits? Come on. Instead, it’s become an icon. That’s in large part because the pizza is consistently incredibly good (as is the rest of the food). No matter what, we always have a great time at Roberta’s.The Manhattan outpost is new (it was a Brooklyn-only staple before this year), but this could not, in good conscience, have been a best NYC pizza round-up without it.",Roberta's,"230 Park Avenue, New York, NY, 10169 (plus one other location)",3.442996742671009,0.9968638566728762
178,rocco pizza iii,366,366,1,"Some say this sunken pizzeria on a side street was the inspiration for Spike Lee’s Do the Right Thing. Whether it was or not, the pizzas are damn good, with a slightly thicker crust than usual, and some fairly creative toppings. The margarita slice is memorable, pooled with fresh mozzarella and dotted with herbs, while the lasagna slice mimics that casserole with an insane amount of delicately seasoned ground beef and wads of fresh ricotta. ",Rocco Pizza III,"330 Halsey St, Brooklyn, NY 11216",0.45602605863192175,0.7567947004909903
179,rockys pizzeria,367,367,1,"This Kensington establishment at the corner of Church and C.I.A. (Coney Island Avenue) has been around since the days of the original Rocky movie, and the interior — ablaze in neon — features boxing memorabilia. The plain cheese slice is great, but why not go for the more spectacular ziti slice. Contrary to type, it also features lots of meat sauce to go with the pasta, making it a real pizza-pasta hybrid. Just try to eat more than one slice.",Rocky’s Pizzeria,"474 Coney Island Ave, Brooklyn, NY 11218",0.45602605863192175,0.6070474472135611
180,rosalias pizzeria,368,368,1,"Proving that old-style neighborhood pizzerias are not a bygone phenomenon, Rosalia’s opened not long ago in Forest Hills, with the same owner as Luzzo’s in the East Village and Gansevoort Market. You can tell the proprietor is a Staten Islander the minute you bite into the spinach and artichoke slice: wads of spinach, a strew of chopped artichoke leaves and choke, little hills of melting ricotta, and a soupy greenish sauce. In Staten Island, the semi-liquid slice is king. ",Rosalia's Pizzeria,"103-15 Queens Blvd, Forest Hills, NY 11375",0.45602605863192175,3.472709553129383e-05
181,rosarios pizza,369,369,1,"The crust is thicker, stiffer, and more browned at this Lower East Side stalwart founded in 1963. For the meat lover, there’s a slice with pepperoni and Italian sausage, buoyed by plenty of mozzarella. In fact, the pizzeria describes this slice and several others as deep dish, referencing a Chicago-style pizza rarely seen in New York, especially among neighborhood pizza parlors. We're lucky to be able to buy it by the slice.",Rosario's Pizza,"173 Orchard St, New York, NY 10002",0.45602605863192175,0.507052036237341
182,rubirosa,370,376,7,"Though Rubirosa Ristorante offers a complete menu of Italian favorites including pasta and salads, its pizzas should not be ignored. Its pies come with so many toppings visitors will barely have any crust to grab. To maximize the topping experience, order the Rubirosa Supreme, which comes with tomato, mozzarella, pepperoni, mini meatballs, and roasted garlicSupreme PizzaImagine a steaming hot plate of penne a la vodka at your favorite neighborhood Italian restaurant. Now imagine that, but with the vodka sauce spread on a cracker-thin pizza crust, topped with fresh mozzarella. If you can’t imagine why this would taste incredible, you clearly haven’t had the vodka pie at Rubirosa. In addition to serving this perfect Staten Island-style pie, Rubirosa is also an overall fantastic restaurant and we can think of few places we’d rather spend an evening eating carbs. The plain pie and tie-dye, which adds pesto the mix, are excellent as well.The perpetually packed Mulberry Street spot has some serious pizza cred: It was founded by third-generation pizza maker Angelo “AJ” Pappalardo, who died at age 40 in 2015, and his father, Joe Pappalardo of Joe & Pat’s in Staten Island. The crisp, thin-crust pies include a standout vodka-sauced iteration, and are supplemented by a slew of classic housemade pastas like a chitarra vongole and cavatelli with broccoli rabe and sausage. The cozy space has a warm, throwback feel, with quaint wallpaper, bright red booths, and old black-and-white photos framed on the walls. It can get packed, so try for a reservation.NoneRubirosa is pizza royalty: The founder is of Joe and Pat's fame—he is the son of the owner of the Staten Island institution. The Rubirosa Supreme creates a salty-sweet medley by combining hand-cut spicy pepperoni, diced basil, and flavorful meatballs atop a firm crust that is both strong enough to withstand the weight of the ingredients and yet soft enough to fold like a typical New York slice. Personal Rubirosa SupremeYes, the same sauce-heavy goodness you see on Instagram all the time.The only thing that is keeping Rubriosa from being one of NYC’s classic Italian restaurants is time. Let’s eat vodka sauce pizza while we wait.Reading our old reviews is like digging up a time capsule. What was I doing back in 2011 when we first wrote up Rubirosa? Apparently hanging out in Nolita a lot and using the word “hip” to describe cool things. “The Infatuation: Restaurant Reviews From Your Dad.”Pizza, Italian, Big Groups, Date Night, First/Early in the Game Dates, Gluten-Free Options, Literally Everyone, ",Rubirosa,"235 Mulberry Street, New York, NY, 10012",2.5472312703583055,0.9911619000121119
183,sabrinas,377,377,1,"Founded in 1977 in the shadow of the M and J tracks, this parlor is young in pizzeria years, but excels at all the classic pies and hero sandwiches. Some of the best things on the menu, though, show a Latin bent. For example, the miniature pie called an onion pizzette is about as close as you can get to a real Buenos Aires fugazetta. Other favorites include a spinach-ricotta slice that seems positively healthy, and an idiosyncratic take on a hot dog, wrapping it in pizza dough with melted cheese. Delicious!",Sabrina's,"294 Broadway, Brooklyn, NY 11211",0.45602605863192175,0.9452593704265176
184,sacs place,378,378,1,"Sac's is a large pizzeria-restaurant in Astoria that has the distinction, after Patsy's, of serving the only other coal-oven slice in New York. They do the initial bake in the coal oven, and when you order a slice, they reheat it in a standard gas-fired deck oven. There's not a ton of buzz around Sac's, but it was the best slice on the Queens leg of our initial pizza crawl—thin, crisp, with a bright tomato sauce and just enough cheese. It really should get more attention than it does.",Sac's Place,2541 Broadway,0.260586319218241,0.3562425752167156
