,sort_name,df_min,df_max,appearances,review,name,address,pro_score,sentiment
0,adriennes pizza bar,0,1,2,"Adrienne’s Pizza Bar serves large pies on Stone Street in FiDi, with outdoor and indoor areas if you’re looking for more than just a slice or two.The Stone Street main drag is littered with bars and restaurants, all of which have outdoor seating areas that bleed into one another. It’s an appealing place to hang out in the area, certainly. So which of the many restaurants should you pick? Sure, the Bavaria Beer Haus will do if you want to drink hefeweizen out of a boot, and the Mexican restaurant “Mad Dog and Beans” is an option if you want to patronize a place called “Mad Dog and Beans.” But if you actually want to eat, do it at Adrienne’s Pizza Bar. The large pies are pretty good (no slices, FYI), and the inside area is pretty nice.Pizza, Big Groups, Casual Weeknight Dinner, Late Night Eats, Standing strong amid the fratty Stone Street bars is Adrienne’s Pizzabar, an above-average pie purveyor in the Financial District. It serves up two types of pizza: New York-style round pies and Grandma-style squares, of which the latter is the standout. Adrienne’s also delivers well for workers in the area in need of a lunchtime pizza fix.",Adrienne's Pizzabar,"54 Stone St, New York, NY 10004",0.276872964169381,0.8870867548276181
1,alligator lounge,2,2,1,"Alligator Lounge is a divey sports bar in Williamsburg that gives out free pizza to everyone who buys a drink.You may know Alligator Lounge as that dive-y bar in Williamsburg that does $6 shot and beer combos and gives out free pizzas to anyone who buys a drink. While they do that, and it’s a pretty crazy deal, this is also a solid spot to watch some sports (especially NFL games on Sundays). You’ll find a pool table and some games like Connect 4 and Jenga, too, in addition to free karaoke most nights.Pizza, Big Groups, Day Drinking, Sports!, ",Alligator Lounge,,0.016286644951140017,0.8768963121703197
2,amore pizzeria,3,3,1,"If you love ample amounts of rich sauce and oily cheese set on a thin crisp crust, that's Amore. The decor of the kitchen and dining area retain the homey style of a stereotypical city pizzeria with its tight quarters, colorful juices swirling in their dispensers, and a greasy menu board lacking several letters. Tasty and consistently delicious in its simplicity, it's no wonder loyalists have been frequenting this place for decades.Cheese",Amore Pizzeria,,0.5863192182410422,0.849441264906803
3,antika,4,4,1,"This Astoria restaurant is named as an homage to Antica Port'Alba, arguably the oldest pizzeria in the world. The Old Fashioned Grandma Style Square Pie is big enough for a family—the cookie sheet-shaped pizzas are loaded with four types of high quality cheeses, savory San Marzano tomato sauce, extra virgin olive oil and oregano, then twice-baked in a gas-powered oven yielding a crust that provides a sturdy foundation for the toppings without feeling too heavy.Old Fashioned Grandma Style Square",Antika,,0.5700325732899021,0.012290998741984598
4,antonios,5,7,3,"An old newspaper article pinned beside the door proclaims Antonio’s 50th anniversary, so by now it must be much older. The Park Slope stalwart is all over the map pizza-wise, even making an approximation of deep-dish Chicago pies, and regular pies with Alfredo and vodka sauces, as if pizza were pasta. Amid the welter of pizza forms is a perfect grandma — a paradoxically square and thin slice, with the crust like a piece of delicious cardboard. Splotches of mutz and torn basil leaves powerfully scent the pie.  Sometimes, you just need a slice joint. Not a twist-on-a-slice joint, but just a slice joint. A place where you can engage in New York's greatest culinary tradition, exchanging a couple of bucks for a piece of hot pizza that you can fold in half and eat on a paper plate as you walk down the sidewalk. And Antonio's in Prospect Heights delivers on that promise -- with a slice that has a crispy crust, a healthy dose of sauce and a blanket of blistered mozzarella. Like any good neighborhood pizza place should, it also offers a selection of solid specialty slices -- from the grandma to the controversial Buffalo chicken. The Vibe: This no-frills, old school pizzeria has been serving fresh slices for over fifty years.",Antonio's Pizzeria,"32 Court St, Brooklyn, NY 11201, USA",0.9934853420195437,0.9730980944829235
5,arcade bakery,8,8,1,"New York's best croissant is now located in the back of a Tribeca office lobby. Plan accordingly.Here's what Arcade Bakery is not: the hottest new underground restaurant with a monthlong waiting list. It's in the lobby of an office building, and seating, amazingly, is even plentiful. Another thing it's not: some swanky new date spot, unless your version of a date is croissants and pizza before 4 pm on a weekday.Pizza, French, Coffee & A Light Bite, Impressing Out of Towners, Lunch, ",Arcade Bakery,,0.27361563517915294,0.5654053286951292
6,archies bar & pizza,9,11,3,"Archie’s is a pizza place in Bushwick serving simple pan pies that are exactly what you want before or after a night out.If you wanted to, you could go out tonight and get a pizza made with Italian yeast and cheese from Naples. Or you could get a square slice made from dough that was fermented for as long as it would take you to learn at least rudimentary French. And we’re glad that both of those options (in addition to many others) exist in NYC. But sometimes you just want to eat at a spot like Archie’s Bar & Pizza.Bar Food, Pizza, Casual Weeknight Dinner, Delivery, Late Night Eats, This hang-worthy Bushwick bar also serves Greek New England-style pies, a style not commonly seen across New York. It’s cooked in a pan and a little heftier and crisper than a wood-fired or New York-style pie, though the crust’s interior is still quite light. Get it by the slice or in a 10-inch or 14-inch pie. Open late.Let’s face it—pizza just tastes better after midnight. For the best pizza after dark, head to Archie’s Pizza. There, visitors can grab a slice or an entire pie until 4 a.m. But, have no fear as the pizza shop opens again at 11 a.m. for all the non-night owls out thereLate-Night Eats",Archie’s Pizza,128 Central Ave.,0.6254071661237783,0.8003944086394077
7,armandos pizza,12,12,1,"This newish Ocean Hill establishment is a branch of a long-running Canarsie pizzeria that’s been in the D’Arpa family since 1968, now being run by a third generation. Like the sign outside says, the mini-chain’s specialty is the Sicilian slice (only $2.50!), and you’ve never tasted better. The bread is thick and bouncy, but paradoxically light-textured, and the sauce in the typical Sicilian style is a little on the sweet side. In addition, there’s a strong taste of oregano, which may or may not be due to the Greek origin of many Sicilians. Other specialties include a delicious, sesame-seeded ground beef stromboli, pepperoni pinwheels, and meatball rolls.",Armando's Pizza,"1717 Broadway, Brooklyn, NY 11207",0.45602605863192175,0.8779118260384218
8,artichoke,13,15,3,"Come on people, this is completely out of control. It's Thursday night at 2:30am and there's a line forty deep for a slice of pizza? That's just stupid.Come on people, this is completely out of control. It's Thursday night at 2:30am and there's a line forty deep for a slice of pizza? That's just stupid. At the painfully slow rate at which Artichoke moves, that's at least an hour wait. By the slice, pizza is supposed to be that cheap, quick fix - but Artichoke is neither. I totally hopped on board the 'Choke bandwagon when it opened, and was pushing it on people non-stop. After all, how could I resist hyping up a hot new slice right next to my apartment? Unfortunately, there was trouble in paradise, and I soured on this place pretty fast.Pizza, Late Night Eats, People Watching, You gotta do it. If you're gonna come to this city, you need to buy a single slice of this melty, dippy masterpiece and take it straight to the face on a super cold day. You gotta do it.Artichoke opened to rave reviews in early 2008 and pizza lovers throughout the city have been flocking to their ever-expanding locations across NYC ever since. They're especially known for their signature artichoke-spinach slice, but the Sicilian option here is a close second. Although the prices are on the high side, the slices are huge enough to match.",Artichoke Basille's Pizza,"321 E 14th St, New York, NY 10003, USA",1.0260586319218237,0.4991088078415209
9,astoria hot pizza,16,16,1,"Who can resist the white slice at Astoria Hot Pizza, with its masses of ricotta and mozzarella on an un-tomatoed crust, like driven snow after a blizzard. The chicken slice is another favorite: a diced cutlet, tasting fresh from the fryer, scattered across what would otherwise be a regular cheese slice. It’s like a deconstructed chicken cutlet parm hero. This place shares space with a Middle Eastern grocery store, which allows an unusual latitude in the selection of beverages.",Astoria Hot Pizza,"32-04 30th Ave, Long Island City, NY 11102",0.45602605863192175,0.8994191236769407
10,b squared,17,17,1,"B Squared is in here because it is my neighborhood place, and it is SO GOOD. May I recommend their Honey Bee pie? It's a tomato-mozz-sopressata-garlic-puree-chili-oil-honey DELIGHT.",B Squared,"679 9th Ave New York, NY, 10036",0.260586319218241,0.7512870518507505
11,babbalucci,18,18,1,"Babbalucci is a neighborhood Italian spot in Harlem with one key advantage: a wood-burning oven they use to make about 20 different types of pizza.Walk into Babbalucci, and you’ll notice a wood-burning oven in the back of the dining room. And that’s what makes this place an above-average neighborhood Italian restaurant. They do about twenty different pizzas in two different sizes (with toppings like duck prosciutto and gorgonzola) in addition to a full menu of pastas, small plates, and proteins. This place isn’t huge, but it’s cozy and family-friendly and the little front patio is a great place to drink wine when it’s nice out.Pizza, Italian, Casual Weeknight Dinner, Kids, ",Babbalucci,,0.016286644951140017,0.9059737089992016
12,bad boys pizza,19,19,1,"Situated in the midst of what is rapidly becoming the city’s fifth Chinatown, Bad Boys is a classic full-service pizzeria, rolling out such sidelines as baked manicotti, pepper-and-egg heros, and fried calamari. But the star of the show remains the pizzas, especially the fresh mozzarella pie with a soupçon of olive oil dribbled atop the cheese, and the square Sicilian, with a crust a little thinner and crunchier than most and a fragrant scatter of dried herbs.",Bad Boys Pizza,"2313 86th St, Brooklyn, NY 11214",0.45602605863192175,0.25149004134133723
13,barboncino,20,21,2,"Barboncino is a neighborhood pizza place in Crown Heights that's kind of like the Roberta's of the area. It's good and family friendly.Barboncino is the go-to sit-down pizza place in Crown Heights. Think of it as the Roberta’s of the area, but less crowded. The pizzas are Neapolitan-style (thin, chewy, a little burnt) and they come in a handful of red and white varieties. There are also salads and a few small plates, and the space is big and family-friendly.Pizza, Big Groups, Casual Weeknight Dinner, Dinner with the Parents, None",Barboncino,"781 Franklin Ave (btwn St Johns & Lincoln Pl), Brooklyn, NY",0.547231270358306,0.8994191236769407
14,bari pasta & pizza,22,22,1,"In an iconic Stapleton location across the street from Tappen Park, Bari’s specializes in an indigenous type of Staten Island pie that features dense, dairy-driven toppings. Shown here are two representative slices: One is a pizza-fication of the Philly cheesesteak, swamped with thin-sliced steak, caramelized onions and peppers, and a Whiz-type cheese; the other attempts to mimic a pasta Alfredo in slice form. Both are rich and taste better than they look. The pizzeria is named after the capital of Apulia, the homeland of many Staten Islanders and Brooklynites.",Bari Pasta & Pizza,"596 Bay St, Staten Island, NY 10304",0.45602605863192175,0.6167639278448227
15,beebes,23,23,1,"Beebe’s is a restaurant in the bottom of The Boro Hotel in LIC, and it’s a perfect for when you’re in the area and need something easy.Some restaurants aim for the stars, like John Glenn and Alan Shepard in the early days of NASA. Others just try a few new tricks, like a pilot doing a barrel roll. Beebe’s, on the other hand, sticks closer to the earth - and, as a result, it’s the sort of place where you can eat on a weeknight and have no regrets.Pizza, Italian, Date Night, ",Beebe’s,,0.25081433224755695,0.8201358785157592
16,belmora,24,24,1,"This agreeable East Side pizzeria offers a larger dining room than most and a sunny southern exposure. The slices are about average in thickness and crispness, with a tomato sauce rich and herbal but not sweet. Its forte is unexpected combinations of ingredients, including a great pepperoni and black olive slice that turns out to be fantastic. Plus, it's open at 8 a.m., seven days a week — in case you'd like a slice for breakfast.",Belmora,"139 E 57th St, New York, NY 10022",0.45602605863192175,0.9459710281195371
17,bergen pizza,25,25,1,"This quintessential Brooklyn pizzeria has seen progress overtake it. Where once its main feature was proximity to a police precinct, now it’s being engulfed by the nearby Atlantic Yards developments. For a neighborhood joint, it sure has a nice dining room, though perhaps a little more lit than you might like. The thing to get here is the Sicilian slice, which is nicely salty with more cheese than you usually get. The crumb is dense enough that one’s a meal. Salads are unexpectedly spot-on here.",Bergen Pizza,"67 6th Ave, Brooklyn, NY 11217",0.45602605863192175,0.8284156440598206
18,best italian pizza,26,26,1,"This mainstay with a self-congratulatory name sits just east of the South Bronx shopping district called the Hub. Open since 1958, it was founded at the dawn of the neighborhood pizzeria era, when the stacked pizza oven was first popularized, and the old-fashioned interior, with an order window on the street, shows it. The slices are thicker, with lusher toppings than usual, and the accommodating pizzaioli will ladle extra sauce on a slice at your request. Get the white spinach, which boasts clouds of soft ricotta and plenty of garlic.",Best Italian Pizza,"412 E 149th St, Bronx, NY 10455",0.45602605863192175,0.19566542362849745
19,best pizza,27,33,7,"The name sounds like the product of asking someone on level one of Rosetta Stone English what they thought of their first visit to New York. But you won’t care that typing the name into Google pulls up every pizza spot in the city, or that they only offer a few different kinds - because the wood-fired slices here are so good that you’ll keep burning the roof of your mouth instead of waiting two minutes for them to cool off. The classic cheese and the grandma square are both great, but the white pie with ricotta and caramelized onions is easily one of the best individual slices you can buy. It’s a good thing they didn’t spend more time on decor or workshopping their name. Clearly they were focused on more important things.Best Pizza is a wood-fired pizza spot that serves classic New York City slices in Williamsburg.Sometimes simple is best. Two-in-one shampoo and conditioner, E equals MC squared, Murphy beds. Thanks to these, you don’t need to worry about how well your Herbal Essences conditioner will work with your Pantene shampoo, or the best place to put a bed in a 200-square foot apartment, or how mass and energy are related in the universe. Best Pizza is another simple solution for something just as important - where to find great pizza-by-the-slice in Williamsburg.Pizza, Cheap Eats, Dining Solo, Late Night Eats, Lunch, Quick Eats, Serious Take-Out Operation, Naming yourself Best Pizza and opening up shop in the middle of Williamsburg is a bold move. Fortunately, Best Pizza does belong on a best pizza list. They execute classic New York pies and white pies at very high level, and unlike so many others on this list, the place is laid back and operated by very nice and friendly people.When it comes to the thoughtful reinvention of the classic New York slice here in the city, Frank Pinello may be Patient Zero. In retrospect, it seems inevitable. He was raised in Bensonhurst, trained at the CIA, and opened a slice shop in Williamsburg at the height of Brooklyn's mid-aughts renaissance. Those factors seem to have shaped the pizza he makes at Best, which is cooked in a massive brick bakery oven from the early 20th century—a setup that would have been familiar to the men who started the New York coal-oven giants Totonno's, John's, and Patsy's (though Best uses wood as fuel).  At the same time, Pinello's Culinary Institute chops reveal themselves in the attention he pays to ingredients—making, then shredding, fresh mozzarella for the cheese; pickling various vegetables for the sesame seed–crusted white ""pickled veg"" slice; respecting the ingredients enough to let them stand on their own, as with the nice bright sauce on the plain slice, which is made simply from good-quality crushed tomatoes. The crust on the regular slices is thin yet pliable, with a satisfyingly crisp-springy texture and great hole structure. The grandma slice has a light and crisp crust and a punchy sauce spiked with garlic and finely chopped anchovies. You simply cannot order the wrong slice here—and that's before we even mention the fantastic sandwiches, which we won't, because this list is all about pizza. The Vibe: Housed in a former bakery in Williamsburg, the homey pizzeria's walls are decorated with customer designed paper plates. You'd never know it from the modest digs and $3 slices, but this Williamsburg pizza joint boasts a serious pedigree. Occupying the former Brooklyn Star space, it's backed by the owners of Roberta's, who tapped Pulino's alum Frank Pinello as pizzaiolo. He's turning out pies topped with seasonal vegetables and local goods; the house-special Grandma pizza, available only by the square slice, features anchovy-laced plum tomato sauce and mozzarella. Perch on one of 16 wooden seats if you like, or take your grub to go—the food, not the ambience, is the real draw here.Mushroom with caramelized onion Best Pizza is a Williamsburg take on a classic slice joint. There's the simple menu of pizzas and heroes, a small selection of beers and wines to wash it down, booths and paper plates both for your pizza and decorating the walls. But this being Williamsburg, the pizzas have hip touches (a sesame crust on the white pie, for example), the oven is wood-fired and not a stacked gas oven. The simple name, spelled out in a sign that looks way older than the pizzeria's seven years, is a sort of tongue-in-cheek throwback. The soundtrack is loud rap instead of the oldies station or Frank Sinatra playlist you'll find at the usual corner place. And the pizza hits it out of the park: the ideal unfussy New York slice, thin crust and tasty tomato sauce covered in a just-sparse-enough blanket of cheese and classed up with some basil leaves. ""We use a wood-fired oven -- it's over 100 years old. I feel like that definitely makes a difference. You get a little more char on the pies; you get a little bit of a smokey flavor to it,"" general manager Hugo Chino said. ""We use fresh mozzarella on all of our pizza, we cook our mozzarella here and I feel like that makes us a little bit different from other pizzerias that are by the slice."" ",Best Pizza,33 Havemeyer St.,2.475570032573289,0.9983388707717051
20,bocce union square,34,34,1,"Bocce USQ is an outdoor Italian restaurant in Union Square Park, and it’s perfect for an after-work spritz when you’d rather be in Rome. In the early aughts, there was a television show hosted by Xzibit called Pimp My Ride. We don’t currently have time to explain who Xzibit is, but the show itself always involved a very average car getting a big makeover. A van might wind up with a hot tub, for example, or an old TransAm might get a new paint job, a chandelier, and an incredibly impractical espresso machine.Pizza, Italian, Date Night, Drinks & A Light Bite, Outdoor/Patio Situation, ",Bocce Union Square,,0.25732899022801287,0.3998578205576631
21,bono trattoria,35,35,1,"Bono’s excellent pizza and pasta and low-key atmosphere make it our favorite spot for Italian food in Harlem.Bono Trattoria serves excellent Neapolitan pies and fresh pastas in a setting that works for everything from a friend hang, to a date, to dinner with your parents. It’s run by a couple of Italian guys, and it’s the kind of place where you could just as easily split a couple pizzas and bottles of wine at happy hour as you could go for a full-on multi-course dinner. They open up all the big windows in the summer so that it feels indoor/outdoor, and the space has a laid-back, really comfortable feel. This is our favorite place to eat Italian food in Harlem.Pizza, Pasta, Italian, Big Groups, Casual Weeknight Dinner, Date Night, Dinner with the Parents, ",Bono Trattoria,,0.016286644951140017,0.9714669004009873
22,bravo pizza,36,36,1,"This especially comfortable pizzeria is part of a Manhattan mini-chain, with a deep dark interior kept cool in sweltering weather, and mounts an enticing display of by-the-slice pies to lure passersby, some of them rather creative. Of several sampled, the one topped with pepperoni and canned jalapeños was the most enthralling, mouth-tingling in the best possible way.",Bravo Pizza,"6 E 42nd St, New York, NY 10017",0.45602605863192175,0.8160973990897586
23,broadway pizza & pasta,37,37,1,"Located in hilly Kingsbridge and boasting a big and comfortable dining room, BPP is deluxe for a neighborhood joint. The best slice wasn’t the Neapolitan pepperoni or the Sicilian cheese, but the lasagna slice, with gobs of mellow ricotta, splotches of sweet sauce, and herb-scented ground beef. You won’t miss the noodles. For a bigger meal and a spicy kick in the pants, try the chicken fra diavolo ala Rosa, one among many entrees served with spaghetti, ziti, or salad with garlic bread. The slogan of this delightful spot is, “The taste you always come back to,” and we will! ",Broadway Pizza & Pasta,"192 W 231st St, Bronx, NY 10463",0.45602605863192175,0.84036376382514
24,brooklyn pizza crew,38,38,1,"The Vibe: Although at first glance Brooklyn Pizza Crew appears to be a ubiquitous storefront Brooklyn pizzeria, it isn't. The graffiti art on the wall and the wooden tables give the spot a more modern feel. ",Brooklyn Pizza Crew,"758 Nostrand Ave, Brooklyn, NY 11216, USA",0.3745928338762214,0.056920987641042656
25,brooklyn pizza market,39,39,1,"Brooklyn Pizza Market is a takeout pizza spot in Carroll Gardens with a joint Star Wars/New York Jets theme.Brooklyn Pizza Market is, most likely, the only pizza place on Earth that’s equal parts New York Jets and Star Wars-themed. This is a tiny spot on Smith Street, and they make pizzas with names like Gang Green and C3PO. They do both square and round pizzas here, and you can customize either kind with upscale toppings like fontina, prosciutto, and sopressata. It’s a great pickup or delivery option, and it’s perfect for when you need a quick slice or some garlic knots handed to you by a person in a Jets hat.Pizza, Carroll Gardens, Quick Eats, Serious Take-Out Operation, ",Brooklyn Pizza Market,,0.016286644951140017,0.8125545224875897
26,brothers,40,40,1,"For 49 years Brother’s has occupied a prime spot in Fordham Manor, with the elevated 4 train towering overhead. The premises are very modest indeed. The plain slice is thin crusted and cheesy, and the sauce is practically unseasoned, which is just fine with me. Other pies beckon, more often available as whole pies rather than individual slices, including a lasagna pie, a salad pie, and a Hawaiian pie with ham and canned pineapple, a favorite in South America.",Brother’s,"27 E Kingsbridge Rd, Bronx, NY 10468",0.45602605863192175,0.41405505376683155
27,brothers pizza,41,41,1,None,Brother's Pizza,"750 Port Richmond Ave, Staten Island, NY",0.6254071661237783,0.056920987641042656
28,brunetti,42,42,1,"This West Village joint, opened in 2013, is an offshoot of a Westhampton pizzeria. Head here for wood-fired pies, particularly the clam pie, one of the best versions available in NYC. The margherita and Brussels sprouts pies are strong choices, too, and can be enjoyed in the garden out back.",Brunetti,"626 Hudson St, New York, NY 10014",0.260586319218241,0.682673991324121
29,bruno pizza,43,43,1,"Bruno in the East Village mills its own whole wheat flour, and tops its pizza with things like fermented tomatoes. It's...interesting.Bruno Pizza has a special mill that mills special whole wheat flour. The pizzas are topped with things like fermented tomatoes and peaches. It's like science lab, but with pizza.Pizza, Vegetarians, ",Bruno Pizza,,0.25081433224755695,0.8725048010973935
