,sort_name,df_min,df_max,appearances,review,name,address,pro_score,sentiment
125,mona lisa,244,244,1," In the heart of Annadale Road's commercial strip you'll find Mona Lisa, a hybrid between a typical slice joint and a specialty pizza spot. Among the offerings are the borough's best buffalo chicken pizza and owner Leonardo Giordano's ""Gold Medal Pie"" (pictured), with mushrooms, sun-dried tomatoes and rosemary in a cognac sauce, placed atop a thin spread of tomato sauce and then finished with fresh arugula, shaved Parmigiano-Reggiano, speck and truffle oil. It's so-named because it has won Giordano, a member of the U.S. Pizza Team who competes nationally and in Italy, plenty of top prizes. ""My magic word is one: creativity. And quality comes with that,"" Giordano said. ""When you create something that is unique, then people don't mind to pay the extra dollar. They know it's unique. I feel like it's a custom pizza for every customer."" ",Mona Lisa,839 Annadale Rd.,0.09771986970684038,0.9371009446210526
126,montes,245,245,1," Monte's claims to be the oldest Italian restaurant in Brooklyn, though it did have a bit of a hiatus. It first opened in 1906 as Angelo's Tavern, served as a speakeasy during Prohibition and was revamped into Monte's Venetian Room in the 1930s, going on to draw a Rat Pack clientele for Italian-American food. But it abruptly closed in 2008. It reopened in 2011 under new ownership, the Venetian part of the name (and the murals that went with it) were ditched, and the menu was tweaked to focus less on chicken parm and more on authentic Neapolitan dishes -- among them, pizza. The pizzas at Monte's are oblong, served on boards, available in 12-inch or ""Metropolitan"" size (best described as really big), and deliver on the promise of a Neapolitan pie, with a puffy but crispy crust. And then there are the toppings. The Margherita pie has mozzarella di bufala; the Reale has tomato, mozzarella, fried eggplant, prosciutto and basil; and the Salsiccia has tomato, mozzarella, sausage and red onion. All are winners. The restaurant is more under the radar than some spots on this list, with a vibe that's way more old-school Brooklyn than hipster, but it's worth a little trip back in time the next time you're in Gowanus to play shuffleboard. ",Monte's,451 Carroll St.,0.0,0.8725048010973935
127,motorino,246,252,7," Motorino has gone worldwide, but it was a bit of a revelation when it first opened in Williamsburg in 2008. In 2010, Sam Sifton of The New York Times declared that it served ""the city's best pizza"" -- a wood-fired Neapolitan pie that he deemed delicious hot out of the oven or cold after sitting a few minutes. Start with a Margherita pie: fior di latte, basil, pecorino, olive oil and sea salt. Or upgrade to the Dom Dom: buffalo mozzarella, primo sale (a sheep's cheese) and parmigiano. Or go in an entirely different direction, with white pies showered with Brussels sprouts and pancetta or bresaola and baby kale. Come with me away from the lower half of Manhattan for a sec, will you? Motorino's pizza is like all girls next door in every movie ever: She's always been there, right in front of you, but you never realized how perfect she was for you until you took a bite took the time to get to know her ... or whatever.From Brooklyn to the East Village, and now back to Brooklyn, Motorino is one of the old guys these days, but it’s still one of the best. The Spicy Sopressata pie would be on our list of best pies anywhere, let alone Brooklyn. Brussels sprouts pie isn’t far behind.Motorino isn't the best pizza in New York City, but it is one of our most frequented pizza joints in town.There's an old saying that refers to conversational etiquette in social
situations, and it goes something like this: ""Never discuss religion and
politics.""Pizza, Casual Weeknight Dinner, Impressing Out of Towners, Serious Take-Out Operation, There’s an UWS outpost of the excellent pizza place that Mathieu Palombino opened up in the East Village in 2016, which serves up the same airy Neapolitan pies in Williamsburg, too; there are also a handful of locations in Asia. The soppressata and Brussels sprouts pies are highlights, and aside from pizza, there are apps like meatballs, baked clams, and roasted artichoke on offer.NoneMotorino serves excellent Neapolitan-style pizza at its locations in the East Village, Upper West Side, and Williamsburg, Brooklyn. All three outposts are popular, so waits are common in the evening and on weekends. The pizzas are on the smaller size, but that offers the opportunity to sample several when you dine with even a small group. In addition to the classic choices, they have some standout specialty options, too; one pie stars Brussels sprouts, for instance, while another comes topped with white anchovies.",Motorino Pizzeria Napoletana,"349 E 12th St, New York, NY 10003-7266, USA",2.407166123778501,0.9834714116630106
128,mr. phils pizza,253,253,1,"The upside-down Sicilian is star of the show at this classic Dyker Heights pizzeria (established in the ‘90s), which is more glitzy and comfortable than its brethren along New Utrecht Avenue, an ancient Dutch thoroughfare that dates to the 17th century. The slice in question is square, thinner, and crisper than most Sicilians, with the mozzarella next to the crust; the rich, thick, sweet tomato sauce on top of that; and a scatter of parmesan on top for enhanced saltiness and cheesiness. The garlic knots are especially good and so are the outsize, deep-fried rice balls, once again demonstrating Sicilian heritage of this excellent place. ",Mr. Phil's Pizza,"7212 New Utrecht Ave, Brooklyn, NY 11228",0.45602605863192175,0.9113443959100268
129,my little pizzeria,254,254,1,"What pizza parlor boasts outdoor seating in the back? This one in downtown Brooklyn does, and also a large dining room perfect for accommodating lunchtime crowds. The supreme slice is the one to get, with an unusually thin crust for a fresh mozzarella slice, browned more than most and hence crisp. The cheese is cooked a little more, too. This is an atypical take on a classic slice, and six or seven more slices are commonly available at any given time.",My Little Pizzeria,"114 Court St, Brooklyn, NY 11201",0.45602605863192175,0.7806591234629022
130,my pie pizzeria romana,255,255,1,"Like Mama's Too, My Pie Pizzeria Romana takes inspiration from revered pizza-maker Gabriele Bonci, who is behind Pizzarium in Rome. When My Pie first opened in its original spot in 2013, astute pizzaheads would have noticed a Bonci cookbook on proud display, alongside a wood pizza peel bearing the mark of Bonci. For the casual eater of pizza, we'll stress that Bonci is an outsize figure in the world of pizza, and when a spot can claim a connection, pizza nerds sit up and listen. It turns out that the two brothers who opened My Pie, Michael and John Ozger, learned from Bonci himself, and now turn out medium-thick, crisp, and light squares topped with good-quality organic ingredients in an unsuspecting part of Midtown. The pizzas are served al taglio out of large trays displayed behind glass, and they bear an abundance of toppings.  My Pie's bready slices would be a fantastic find anywhere, but in its original location on Lexington and 57th, they're a godsend. They've since added a second location on Amsterdam and 72nd on the Upper West Side, which also needed something like this.",My Pie Pizzeria Romana,690 Lexington Avenue,0.260586319218241,0.944548069744937
131,napolis best pizza,256,256,1,"What a charming name! With a tip of the hat to Naples, this tiny pizzeria across the street from Tremont Park is usually thronged with locals enjoying the neighborhood’s best pizza. And this place doesn’t doll it up, either. There are two choices: a plain cheese wedge and a square, extra-thick Sicilian, unless you want pepperoni to be strewn across the top of your slice as an afterthought. The crust is the thing here, beautifully browned, with a little more dough around the circumference than you really need, in order to flaunt the crust’s excellence. And every morsel of crust gets eaten. Astonishingly, a whole 14-inch round pie can be had for $5.50.",Napoli's Best Pizza,"521 E Tremont Ave, Bronx, NY 10457",0.45602605863192175,0.9258283776673639
132,new park pizza,257,258,2,"We struggled with including New Park because it can be inconsistent, and because you have to ask for it well-done if it's to approach its potential greatness. But when it's on, it's so on. The regular slice is the thing to get, cooked in an old brick-lined oven that's got, like, a flamethrower inside. Scott thinks it used to be a coal oven that was just repurposed. They do this thing where they throw salt on the floor of the oven every hour or two, and when you get a just-salted slice? Perfect. It's the little quirks that make the difference here.For 62 years, New Park has been a trusted pit stop on the road to Rockaway Beach. That’s not sand on the bottom of the crust, it’s salt, tossed into the brick oven to keep pies from sticking. Even if you don’t taste salt, you’ll notice the reliable crackle.",New Park Pizza,"156-71 Cross Bay Boulevard (157th Avenue), Howard Beach, Queens",0.5863192182410422,0.5654053286951292
133,nicks pizza,259,262,4,"This old favorite - which only recently started delivering after years of not doing so (probably because of all the stepped up competition) - has one of the best pepperoni pizzas I've ever eaten.While many New Yorkers venture to the boroughs beyond Manhattan in search of the city’s best pizza, they can save a trip out to Queens since the famous Nick’s Pizza of Forest Hills has a location on the Upper East Side, too. Their pizzas are uniformly excellent—a crispy crust, gooey mozzarella cheese, tangy marinara sauce, and a touch of fresh basil that completes their mouthwatering pies. You can choose from some two dozen additional toppings, too. But Nick’s is about more than just pizza. Start your meal with their arugula salad with roasted peppers, sun-dried tomato, and honey-mustard vinaigrette, then finish it off with one of their renowned cannolis.Nick’s is a friendly sit-down pizza place in Forest Hills with thin-crust pies and vinyl booths. If you’re looking for pizza in Forest Hills, go to Nick’s. It’s a neighborhood spot with formica tables and vinyl booths, and it serves crispy thin-crust pies topped with fresh mozzarella. You can also get flattened calzones that are sort of like big grilled cheese sandwiches, and you definitely want one of those in addition to your pizza. Share everything with a group (they don’t do slices).Pizza, Forest Hills, Casual Weeknight Dinner, This Forest Hills gem has been tossing great, expertly charred pizzas with a tangy sauce, lots of fresh mozzarella, and ample sliced-up basil since 1993. It’s superb unadorned, or with some prosciutto and mushrooms on top. The light-filled space with pressed-tin ceilings is more upscale that the average corner joint, but welcoming and unfussy.",Nick's Pizza,"108-26 Ascan Ave, Forest Hills, NY 11375",1.0586319218241038,0.9860304711141193
134,not rays pizza,263,263,1,"Making fun of the Famous Ray's and its imitators, Not Ray's is a normal neighborhood pizza parlor in a memorable, wedge-shaped space right on Fulton Street. The slice has a narrow ""bone"" (the bare circumference of the pie), the cheese is modestly applied, and the tomato sauce piquant and somewhat sweet. The slice is a little gloppier than usual and a molten cheese-sauce hybrid spills over the sides. Dying for novelty? Try the Buffalo chicken or Caesar salad pies.",Not Ray's Pizza,"694 Fulton St, Brooklyn, NY 11217",0.45602605863192175,0.16987677765818382
135,numero 28,264,264,1,This newcomer on Restaurant Row in Forest Hills has sensational pizza offerings.,Numero 28,,0.14657980456026048,0.056920987641042656
136,nunzios,265,266,2,"Despite the old admonition about judging a book by its cover, sometimes you really can look at a slice and not want any part of it. One tell is seeing a slice absolutely blanketed in cheese. That's not the kind of slice Nunzio's serves out in Staten Island. Here, little islands of cheese seem to float on a sea of basil-laced sauce, all atop a perfectly crisp-pliant crust. Many of Staten Island's great pizzas are available as pies only, but for a solid slice joint, head to Nunzio's. In a city increasingly full of fancy pizzas, this squat, square building on busy Hylan Boulevard is home to a lovely but straightforward New York slice: a tangy-but-a-little-sweet sauce, plenty of cheese, a little bit of basil atop a thin-but-not-too-thin crust. It's saucy, with just enough gooey mozzarella to keep things in check. It's simple, but there's a reason that simple formula is the base of a good pizza. ",Nunzio's,2155 Hylan Blvd.,0.35830618892508137,0.9513198495979877
137,ny pizza suprema,267,269,3,"Located directly southwest of Penn Station since 1964, NY Pizza Suprema is undoubtedly one of the most celebrated neighborhood pizzerias in Manhattan. The lavish display of pies under glass right inside the front entrance provides a beguiling dilemma, but we generally spring for any of the Sicilian slices, which have a bit of oil in the dough and are thus crunchier than most. The sausage Sicilian is particularly dope, miring shavings of good fennel sausage in a profuse floe of cheese. Open until midnight, seven days.After leaving the family business to work in law, Joe Riggio eventually came back and took over Suprema from his father, Sal. Located across from Penn Station and Madison Square Garden, the place is always busy, so you're all but guaranteed a fresh slice that hasn't been sitting. It's got a sweet sauce, but it's one satisfying slice nonetheless. If you're going to the Garden, this should be your pre- or post-game slice. If you get to Penn Station early, head here immediately. The regular slice is exemplary, but the upside-down Sicilian is on another level altogether. Super-fast and efficient service, and you can almost always find a seat.For those on the hunt for a seriously cheesy slice, head to Pizza Suprema. There, diners can dig into its famous white pizza, which comes topped with imported romano, ricotta and grande mozzarella cheesesCheese Topping",Pizza Suprema,413 8th Ave.,0.8143322475570032,0.9353336081701389
138,olgas,270,270,1,"Offering virtually no place to sit and eat, only a narrow shelf that runs around the room, Olga’s on Upper Broadway in Hamilton Heights is nevertheless mobbed during the day with neighborhood types, who use it as a sort of stand-up social club. The slice is uber-cheesy, the crust pale and doughy, the tomato sauce less profuse than usual, and yet it tastes fantastic, showing how a distinct point of view is always an asset to a great neighborhood pizzeria. ",Olga's ,"3409 Broadway, New York, NY 10031",0.45602605863192175,0.796103752866825
139,olio pizza e piu,271,271,1,"Olio Pizza e Piu managed to get one of the worst Infatuation ratings ever. Each pizza we ordered was a mess of rubbery cheese and crust – heavy, sloppy and unappetizing. Wow. What a disaster. We had heard mixed things about Olio Pizza e Piu from early online write-ups, but guess where we didn’t find any mixed opinions -inside the restaurant. This was one of the worst meals we’ve had in recent memory, and it wasn’t just us. The group sitting directly behind our table sent back pretty much everything they ate, and once they found out we sent food back ourselves, began using our discontent as an opportunity for class action complaining. The entire evening, we watched as waiters dispatched managers to various tables, each inexplicably with an iPad in hand. Please take this dish back, and no, I don’t want to play Scrabble. The only people that really seemed to be enjoying themselves was the table of 23 to our left, and they got dropped off in a school bus that has karaoke in it.Pizza, Italian, Wasting Your Time and Money, ",Olio Pizza e Piu,,0.052117263843648176,0.028618564323761527
140,ops,272,275,4,"A pizzeria in Bushwick run by Marie Tribouilloy, Mike Fadem and Gavin Compton (who, collectively pull experience from Achilles Heel, Estela  and Buvette) for a neighborhood joint serving up pies. At Ops, you’ll immediately be made to feel like a regular, even if it’s your first time through the door. And while you’ll certainly be there to fill up on one of our favorite pies, the Juno— with broccoli rabe, potatoes, provola and ricotta salata—it’s also one of the only pizzerias we head to for some of the county’s most exciting natural wines. The JunoOps is a pizza restaurant in Bushwick where you’ll want to become a regular even if you don’t live in the neighborhood.It doesn’t take much time living in New York City to realize that finding your own version of Cheers or Central Perk or Tom’s Restaurant or Bada Bing isn’t as easy as you might have hoped. The bartender friend who always comps your shots, the coffee guy who can always tell when you’re having a rough morning, or even the bodega cashier who’s memorized your drunk order so all you have to do is hand him your credit card and shamefully avoid eye contact - if you’ve achieved any of these situations, congratulations. You’re officially living out your very own New York City sitcom.Pizza, Birthdays, Casual Weeknight Dinner, Dining Solo, Eating At The Bar, First/Early in the Game Dates, Walk-Ins, The menu is compact and waits can be long at this Bushwick pizza spot, which serves distinctive, Neapolitan(ish) pies that haven’t gotten, but are certainly deserving of, the type of fanfare other places amass. Founders Mike Fadem, Marie Tribouilloy, and Gavin Compton are alums of Achilles Heel, Estela, and Buvette. The sourdough crust is the main draw here, using a custom flour blend that includes whole wheat from upstate New York and durum from Sicily. Try the basically perfect marinara pie, or the Pops, which features guanciale, onions, and pecorino. Unlike some of the pizza on this list, the stuff at Ops is the kind you want to take your time with - the crust alone is like a piece of buttery sourdough bread. But you’re not shoveling pizza into your mouth at a 9th birthday party before getting back in the pool, so the more moments you have with this pizza, the better. The Neapolitan pies are excellent, but our favorite thing here is the grandma pie, with housemade mozzarella, olives, basil, tomatoes, and a square crust that is thick enough to replace (and upgrade) the walls of your apartment.",Ops,"346 Himrod St, Brooklyn, NY 11237",1.6612377850162863,0.9895105754537158
141,original pizza,276,276,1,"Was the name, like Not Ray’s, created to thumb its nose at the once-mighty Ray’s Original chain? The pizza here is far better, with a thinner crust though still of the plain, old-fashioned slice sort. As in many neighborhood joints, the cheese is the thing — a lake of it, ramping up the protein component and the richness so that one slice is likely to do you for lunch. The location directly over the R train stop at Bay Ridge Avenue is a big asset.",Original Pizza,"6823 4th Ave, Brooklyn, NY 11220",0.45602605863192175,0.7567947004909903
142,osteria laguna,277,277,1,"Osteria Laguna is an Italian restaurant near Grand Central with enough space for a big group (or just you and some pizza and wine). Osteria Laguna is a solid, crowd-pleasing option within walking distance of Grand Central. You'll find pastas, pretty good thin-crust pizzas, and very rich polenta that's so cheesy it almost tastes like queso fundido - but also a space big enough to fit your entire extended family (including everyone’s SOs). If your group just includes you, a speck pizza, polenta with meatballs, and a glass of red wine, that’s cool too - you probably won’t be the only one in that situation.Pizza, Italian, Casual Weeknight Dinner, Dining Solo, Dinner with the Parents, Kids, ",Osteria Laguna,,0.25081433224755695,0.9557925722764123
143,otto,278,278,1,"The food at Otto isn't awful. Otto is, however, an overpriced tourist trap that seems to exist only to make Eataly look civilized and affordable. There was a time, back around 2003, when we thought that Otto was pretty exciting. I had just moved to the city, read the book Heat, and was all about eating Mario Batali food wherever I could. Remember that this was before a sentence like ""new restaurant from a Food Network celebrity"" meant sh*tty food at the hands of the Neelys. Otto was pretty good, pretty unique, and worth a trip every now and again when we felt like eating pizza that we didn't have to point at through a glass sneeze guard.Pizza, Italian, None, ",Otto,,0.1954397394136807,0.9335684952031751
144,ovest,279,279,1,"Ovest is one of the best options for pizza in Chelsea. Ovest is a neighborhood pizza spot on 27th street right by the High Line. This is the restaurant equivalent of someone who comes off as quiet and wholesome, but then turns out to be a little wild. There are candles, wood paneling, and a brick oven you can see from the dining room - but the ABBA pandora station plays loudly while groups of friends drink like they’re not planning on going to work tomorrow. This is one the best options in the neighborhood for Neapolitan pizza - just know that it’s not the place to bring someone for a quiet dinner where you talk about how much you like each other.Pizza, Italian, Big Groups, Date Night, ",Ovest,,0.016286644951140017,0.8889635244912716
145,p&m classic pizza and restaurant,280,280,1,"This two-decade old pizzeria bills itself as “A Taste of Italy in Harlem” — and it is indeed, with an extended menu of chicken, veal, seafood, and eggplant, with full dinners under $20. But most folks dash in for a slice, and the overwhelming favorite is the pepperoni, the sliced sausage vying with the profuse tomato sauce for pungency. Sicilian slices and calzones are also worth ordering.",P&M Classic Pizza and Restaurant,"1747 Amsterdam Ave, New York, NY 10031",0.45602605863192175,0.42805975781307976
146,parkside,281,281,1,"Parkside is a Neapolitan-style pizza spot in Prospect Lefferts Gardens with interesting cocktails and affordable wines.Parkside serves Neapolitan-style pizzas, along with a long list of house cocktails, a block southeast of Prospect Park. The bar is a good spot to dine solo or with a date, and the tables work for a small group hang. They serve some standard pizzas, as well as some more creative ones like miso cod with parmesan and the Sicilian pineapple with jalapenos - our favorite is the lamb sausage with mozzarella. They’re open till 2am everyday, so keep it in mind for a late-night drink option when you’ll probably end up wanting pizza anyway.Pizza, Italian, Date Night, Dining Solo, Late Night Eats, ",Parkside,,0.016286644951140017,0.8768963121703197
147,pasquale jones,282,285,4,"Pasquale Jones is Charlie Bird with pizza, and that’s why we love it so much.t’s no secret that we love Charlie Bird. That’s why we were honestly a little terrified at the prospect of the same team opening Pasquale Jones near our office. What if it’s not as good? What if they don’t play rap music? Will they still have wine? These are the things that keep us up at night.Pizza, Pasta, Italian, Date Night, Dinner with the Parents, Eating At The Bar, See And Be Seen, Special Occasions, Pasquale Jones does two things better than the vast majority of restaurants: wine and pizza. Pasquale Jones does one thing better than every other restaurant: clam pizza. We’ve never eaten a better one, and we’d bet a lot of money that you haven’t either. It’s creamy and salty, and if you do it right, you will squeeze the fat lemon wedge they give you over the entire thing and then add some of the peppers they give you on the side. We’ve found that it tastes even better if you give it a couple minutes to cool off, so you can really taste all the flavors, but we also understand that’s going to be hard to do. That’s where the margherita pie comes in. It’s almost as good as the clam, and if you eat it as soon as it hits the table (while your clam comes to the perfect temperature), you might even briefly forget that other food exists.NoneA divisive choice, maybe, but worthwhile. If you're a fancy person. Who likes fancy pizza. No shade. Just (clam pie) love.",Pasquale Jones,"187 Mulberry Street, New York, NY 10012",2.1889250814332244,0.9818286423842291
148,patricias,286,286,1," On a stretch of Morris Park Avenue where Italian flags wave from utility poles, Patricia's serves a packed dining room brick-oven, Neapolitan-style pies at lunchtime. White tablecloths, tie-clad waiters, brick walls and a crystal chandelier set the tone. (General manager Salvatore Borgognone, 35, compares the setting to ""your mother's house on a Sunday,"" but we'd describe it as more romantic and formal than that.) Ask for a table all the way in the back, and you can watch cooks like Luis Piedia prepare your pizza through the glass partition between the restaurant and kitchen. When Piedia makes the crowd-favorite prosciutto pie from scratch, he tops it with fior di latte mozzarella (as opposed to buffalo, this wet, fresh kind is made with cow's milk) before sliding it into the oven. He adds arugula, cherry tomatoes and chilled slices of dry-cured ham imported from Parma after the pizza has cooked for roughly three minutes. That brisk bake in extremely high temperatures leaves its mark as ""leopard spots"" -- i.e. clusters of char on the crust -- and a floppy center. Spotting Patricia's regular state senator Jeff Klein on our way out the door, we asked him how he likes his pizza: ""I get mine with anchovies and sausage,"" he says. ",Patricia's,,0.04885993485342016,0.8915270191401974
